{"schema":2,"ok":true,"claim":"2e53234c54913e4c1feb101a1c9555446f9f9550fc10b85e01124d09d76b55a0","inputs":5,"outputs":1,"notes":["peak 8 MiB within budget 96 MiB","evidence records process RSS; individual internal allocations are modeled, not measured"],"problems":[],"trust":{"claim_id":"2e53234c54913e4c1feb101a1c9555446f9f9550fc10b85e01124d09d76b55a0","receipt_integrity":{"status":"intact","state":"satisfied","explanation":"The claim hash and every present measurement hash re-derive and match."},"artifact_completeness":{"status":"complete","state":"satisfied","explanation":"Every recorded input and output was supplied and matched by content hash."},"resource_contract":{"status":"within-budget","state":"satisfied","explanation":"The recorded peak fits the 96 MiB budget; enforcement assurance is declared-bound-cooperative."},"reproduction_evidence":{"status":"not-supplied","state":"missing","explanation":"No reproduction certificate was supplied; this does not mean the run is unreproducible."},"signature":{"status":"not-supplied","state":"missing","explanation":"Native schema 5 carries no signature; receipt integrity is hash-based, not identity-authenticated."},"enforcement_assurance":"declared-bound-cooperative","budget_mb":96}}
